{
  "schemaVersion": 1,
  "experimentId": "workflow-first-support-v1",
  "caseId": "direct-delivery-sufficient-truth",
  "armId": "core-all-phases-accepted-delivery",
  "replicate": 0,
  "evidenceClass": "engineering-smoke",
  "sourceRepo": "../../../..",
  "components": [
    { "name": "core", "source": "../../../../src/open-forge", "destination": "" },
    { "name": "delivery-current-truth", "source": "payload/delivery", "destination": "" },
    { "name": "vision-capability", "source": "../../../../src/extensions/skills/vision-capability/payload", "destination": "" },
    { "name": "vision-workflow", "source": "../../../../src/extensions/workflows/vision-workflow/payload", "destination": "" },
    { "name": "architecture-capability", "source": "../../../../src/extensions/skills/architecture-capability/payload", "destination": "" },
    { "name": "architecture-workflow", "source": "../../../../src/extensions/workflows/architecture-workflow/payload", "destination": "" },
    { "name": "planning-capability", "source": "../../../../src/extensions/skills/planning-capability/payload", "destination": "" },
    { "name": "brainstorming-workflow", "source": "../../../../src/extensions/workflows/brainstorming-workflow/payload", "destination": "" },
    { "name": "planning-workflows", "source": "../../../../src/extensions/packs/planning-workflows/payload", "destination": "" },
    { "name": "implementation-capability", "source": "../../../../src/extensions/skills/implementation-capability/payload", "destination": "" },
    { "name": "implementation-workflow", "source": "../../../../src/extensions/workflows/implementation-workflow/payload", "destination": "" },
    { "name": "quality-capability", "source": "../../../../src/extensions/skills/quality-capability/payload", "destination": "" },
    { "name": "testing-workflow", "source": "../../../../src/extensions/workflows/testing-workflow/payload", "destination": "" }
  ],
  "overrides": [],
  "inputs": {
    "cli": { "path": "../../../../src/cli/cli.ts", "invocation": ["{runtime}", "{cli}", "index", "{workspace}"] },
    "prompt": { "path": "prompts/phase-transition-implementation.txt" },
    "rubric": { "path": "rubric.md" }
  },
  "model": { "provider": "unassigned", "id": "replace-before-run", "revision": "unrun", "settings": { "scenarioDefinitionOnly": true } },
  "runtime": {
    "name": "unassigned-external-worker",
    "version": "unrun",
    "adapter": "manual-frozen-script",
    "settings": {
      "scenarioStatus": "unrun",
      "interaction": "Follow only the direct-delivery-sufficient-truth section of the snapshotted rubric.",
      "openForgeCommand": { "available": false, "delivery": "The runner composition CLI is not automatically provisioned to the worker." }
    }
  },
  "isolation": { "freshContext": "unverified", "inheritedContext": "unknown", "workerReceivesOnlyWorkspace": false, "network": "unknown", "filesystem": "unknown" },
  "controls": { "planned": false, "randomized": false, "declaredTreatmentOnly": false, "replicatePlanned": false, "planId": null, "planSha256": null }
}
