{
  "schemaVersion": 1,
  "experimentId": "workflow-first-support-v1",
  "caseId": "explicit-no-workflow",
  "armId": "core-vision-architecture",
  "replicate": 0,
  "evidenceClass": "engineering-smoke",
  "sourceRepo": "../../../..",
  "components": [
    {
      "name": "core",
      "source": "../../../../src/open-forge",
      "destination": ""
    },
    {
      "name": "vision-capability",
      "source": "../../../../src/extensions/skills/vision-capability/payload",
      "destination": ""
    },
    {
      "name": "vision-workflow",
      "source": "../../../../src/extensions/workflows/vision-workflow/payload",
      "destination": ""
    },
    {
      "name": "architecture-capability",
      "source": "../../../../src/extensions/skills/architecture-capability/payload",
      "destination": ""
    },
    {
      "name": "architecture-workflow",
      "source": "../../../../src/extensions/workflows/architecture-workflow/payload",
      "destination": ""
    },
    {
      "name": "scenario",
      "source": "payload/localization",
      "destination": ""
    }
  ],
  "overrides": [],
  "inputs": {
    "cli": {
      "path": "../../../../src/cli/cli.ts",
      "invocation": ["{runtime}", "{cli}", "index", "{workspace}"]
    },
    "prompt": {
      "path": "prompts/explicit-no-workflow.txt"
    },
    "rubric": {
      "path": "rubric.md"
    }
  },
  "model": {
    "provider": "unassigned",
    "id": "replace-before-run",
    "revision": "unrun",
    "settings": {
      "scenarioDefinitionOnly": true
    }
  },
  "runtime": {
    "name": "unassigned-external-worker",
    "version": "unrun",
    "adapter": "manual-frozen-script",
    "settings": {
      "scenarioStatus": "unrun",
      "interaction": "This case is non-interactive except for genuine translation ambiguity; follow the explicit-no-workflow rubric section.",
      "openForgeCommand": {
        "available": false,
        "delivery": "The runner composition CLI is not automatically provisioned to the worker."
      }
    }
  },
  "isolation": {
    "freshContext": "unverified",
    "inheritedContext": "unknown",
    "workerReceivesOnlyWorkspace": false,
    "network": "unknown",
    "filesystem": "unknown"
  },
  "controls": {
    "planned": false,
    "randomized": false,
    "declaredTreatmentOnly": false,
    "replicatePlanned": false,
    "planId": null,
    "planSha256": null
  }
}
